Key,Name_EN,Name_TH,Subtitle_EN,Subtitle_TH,Desc_EN,Desc_TH,AchievementName_EN,AchievementName_TH,AchievementDesc_EN,AchievementDesc_TH
Hero_Aurena,Aurena,,Expelled Sage of the Lunar Arcanum Society,,Aurena is a sage from the Lunar Arcanum Society who was expelled for researching forbidden knowledge. She is a battle healer who dismantles her own life force to wield its power.,,"Horns, Feathers, and Gold",,"Heal yourself or allies for a total of 25,000 Health.",
Hero_Bismuth,Bismuth,,"One Body, Two Minds",,"Bismuth is the fusion of an empty, nameless spellbook and an ordinary blind girl. She moves swiftly and deals sustained ranged damage.",,Once Upon a Time,,Keep any Traveler's Movement Speed above 900 for 3 seconds.,
Hero_Husk,Shell,,"Manufactured Assassin, Wooden Doll with a Soul",,"Shell is the perfect instrument of slaughter, incapable of feeling emotion or pain. An assassin who exploits enemy weaknesses with unpredictable movements, eliminating targets in the most efficient way possible.",,Reactivated,,Breathe life into the wooden doll.,
Hero_Lacerta,Lacerta,,"Former Sniper, Hunter Lizard",,Lacerta is a former Royal Guard sniper and hunter skilled with firearms and gunpowder. He is used to taking out enemies from a distance.,,,,,
Hero_Mist,Mist,,Duelist of House Verdesilver,,Mist is a brave duelist of noble birth. Her agile fighting style allows her to dodge deadly attacks and quickly take down her enemies.,,,,,
Hero_Nachia,Nachia,,"Spirit Mage of the Dream World, Guardian of the Ethereal Forest",,"Nachia is a spirit mage of the dream world and guardian of the Ethereal Forest. She can summon spirits that follow her and fight by her side, dealing steady damage.",,The True Ruler of the Forest,,Defeat the Demon of the Forest 12 times.,
Hero_Vesper,Vesper,,Ruthless Inquisitor of the Order of the Sacred Flame,,"Vesper is the leader of the Order of the Sacred Flame and a ruthless inquisitor. He fights at close range, holding back enemies while dealing heavy damage.",,Boundless Rage,,Reach the Starry Dream.,
Hero_Yubar,Yubar,,"Born of Dreams, God of Stars",,"Yubar is a fantastical being born from dreams, a deity who governs the creation and destruction of stars. He uses powerful magic to deal heavy damage from a distance.",,Pure Imagination,,Acquire a total of 450 Dream Dust.,
